{
  "schema_version": "obs.investigation_start.v1",
  "scope": "run",
  "run_id": "R-TEST",
  "agent_context": {},
  "investigation_route": {},
  "raw_refs": {},
  "data_quality": {
    "dropped": false,
    "drop_count": 0,
    "throttled": false,
    "missing": [],
    "truncated": false,
    "clock_confidence": "medium",
    "notes": []
  }
}
